{
  "$schema": "https://json-schema.org/draft/2020-12/schema",
  "$id": "https://github.com/agentic-starter-repo/.agentic/harness/schemas/agentic.config.schema.json",
  "title": "agentic.config.json",
  "description": "Gates-as-data plus project mechanics for the agentic harness. Policy (approval points, loop caps) lives in approvals.yaml, not here. Note: the harness validates this file with hand-rolled checks in .agentic/harness/src/config.ts; this schema is documentation and editor tooling.",
  "type": "object",
  "required": ["project", "gates"],
  "properties": {
    "$schema": { "type": "string" },
    "preset": {
      "type": "string",
      "description": "Name of the applied preset (.agentic/presets/<name>.json), or \"self\"/\"custom\".",
      "default": "custom"
    },
    "project": {
      "type": "object",
      "required": ["name"],
      "additionalProperties": false,
      "properties": {
        "name": { "type": "string", "minLength": 1, "description": "Project name." },
        "srcDirs": {
          "type": "array",
          "items": { "type": "string" },
          "default": [],
          "description": "Implementation source directories (repo-relative). Used by the integrity gate to spot mixed implementation+test diffs."
        },
        "testGlobs": {
          "type": "array",
          "items": { "type": "string" },
          "default": [],
          "description": "Globs (supports **, *, ?) matching test files. The integrity gate fails on deletions under these globs."
        }
      }
    },
    "gates": {
      "type": "object",
      "description": "Ordered map: gate name -> gate definition. Declaration order is execution order. Canonical names presets bind: format, lint, typecheck, test, coverage, integrity, memory, security, build, e2e (extra names allowed).",
      "additionalProperties": {
        "type": "object",
        "required": ["tier"],
        "additionalProperties": false,
        "properties": {
          "command": {
            "type": "string",
            "minLength": 1,
            "description": "Shell command run via `sh -c` from the repo root. Required unless optional is true."
          },
          "tier": {
            "enum": ["fast", "full"],
            "description": "fast: every commit / pre-push / PR CI. full: pre-merge / merge queue."
          },
          "optional": {
            "type": "boolean",
            "default": false,
            "description": "Optional gates missing a command are skipped with a notice instead of failing."
          },
          "timeoutSeconds": {
            "type": "number",
            "exclusiveMinimum": 0,
            "default": 600,
            "description": "Kill the gate's process group after this many seconds; a timeout is a failure."
          }
        }
      }
    },
    "loop": {
      "type": "object",
      "additionalProperties": false,
      "description": "Default runner ONLY — the loop's hard caps live in approvals.yaml.",
      "properties": {
        "runner": { "type": "string", "default": "claude", "description": "Default agent runner: claude, copilot, or mock." }
      }
    },
    "memory": {
      "type": "object",
      "additionalProperties": false,
      "properties": {
        "dir": { "type": "string", "default": ".agents/memory", "description": "Memory bank directory (repo-relative)." },
        "coreBudgetLines": { "type": "number", "exclusiveMinimum": 0, "default": 200, "description": "memory lint fails when MEMORY.md exceeds this many lines." },
        "staleDays": { "type": "number", "exclusiveMinimum": 0, "default": 45, "description": "memory lint warns when activeContext.md lags HEAD by more than this many days." }
      }
    },
    "designs": {
      "type": "object",
      "additionalProperties": false,
      "description": "Design doc pipeline: self-contained single-file HTML design documents validated by `agentic design check` and previewed via `agentic serve`.",
      "properties": {
        "dir": {
          "type": "string",
          "minLength": 1,
          "default": "docs/designs",
          "description": "Directory holding *.html design docs (repo-relative). TEMPLATE.html inside it is the `design new` scaffold and is excluded from checks."
        },
        "publishCommand": {
          "type": "string",
          "minLength": 1,
          "description": "Shell command run via `sh -c` from the repo root by `agentic design publish`, with DESIGN_FILE (absolute path) and DESIGN_SLUG in the environment. Publishing is disabled when unset."
        }
      }
    }
  }
}
