{
  "$schema": ".agentic/harness/schemas/agentic.config.schema.json",
  "preset": "self",
  "project": {
    "name": "agentic-starter-repo",
    "srcDirs": [".agentic/harness/src"],
    "testGlobs": [".agentic/harness/tests/**"]
  },
  "gates": {
    "lint": { "command": "cd .agentic/harness && npm run lint", "tier": "fast" },
    "typecheck": { "command": "cd .agentic/harness && npm run typecheck", "tier": "fast" },
    "test": { "command": "cd .agentic/harness && npm run test", "tier": "fast" },
    "integrity": { "command": "node .agentic/harness/dist/cli.js integrity", "tier": "fast" },
    "memory": { "command": "node .agentic/harness/dist/cli.js memory lint", "tier": "fast" },
    "designs": { "command": "node .agentic/harness/dist/cli.js design check", "tier": "fast" },
    "build": { "command": "cd .agentic/harness && npm run build", "tier": "full" }
  },
  "loop": { "runner": "claude" },
  "memory": { "dir": ".agents/memory", "coreBudgetLines": 200, "staleDays": 45 }
}
